{
  "$schema": "https://json-schema.org/draft/2020-12/schema",
  "$id": "https://github.com/nashiusagi/slide-design-system/experiments/harness-intro/schemas/run.schema.json",
  "title": "保存済み Run（run.json）",
  "$comment": "生成結果を1回分保存する形式（DR-0014 / DR-0020）。scripts/evaluate-run.mjs の save サブコマンドが書き出し、score サブコマンドが読み直して採点する。生成そのもの（AI の起動、DR-0019）はここに含まない。採点結果（scoring.json）は再実行のたびに作り直す派生物なので、このスキーマの対象にしない。",
  "type": "object",
  "required": ["id", "experiment", "condition", "createdAt", "prompt", "source"],
  "additionalProperties": false,
  "properties": {
    "$comment": { "type": "string" },
    "id": {
      "type": "string",
      "minLength": 1,
      "pattern": "^[a-z0-9]+(-[a-z0-9]+)*$",
      "description": "runs/<id>/ のディレクトリ名と一致する。"
    },
    "experiment": {
      "type": "string",
      "minLength": 1,
      "description": "この Run が属する experiment のディレクトリ名（例: harness-intro）。"
    },
    "condition": {
      "type": "string",
      "enum": ["baseline", "harness", "harness-corrected"],
      "description": "manifest.json の conditions に対応する。harness-corrected は harness の Run を人が修正して保存し直したもの（DR-0014）で、manifest.json の conditions には無い。"
    },
    "correctedFrom": {
      "type": "string",
      "minLength": 1,
      "description": "condition が harness-corrected のときの、修正元になった Run の id。それ以外の condition では持たない。"
    },
    "createdAt": {
      "type": "string",
      "minLength": 1,
      "description": "Run を保存した日時。ISO 8601（例: 2026-09-09T12:00:00.000Z）。"
    },
    "model": {
      "type": "string",
      "minLength": 1,
      "description": "生成に使ったサブエージェントのモデル名。任意。"
    },
    "prompt": {
      "type": "string",
      "minLength": 1,
      "description": "使用したプロンプトファイルへの、リポジトリルートからの相対パス。"
    },
    "source": {
      "type": "object",
      "required": ["files"],
      "additionalProperties": false,
      "properties": {
        "files": {
          "type": "array",
          "minItems": 1,
          "items": { "type": "string", "minLength": 1 },
          "description": "runs/<id>/source/ 配下に保存したファイルの、source/ からの相対パス一覧。"
        }
      }
    },
    "notes": {
      "type": "string",
      "description": "生成中に人やサブエージェントが残した所見。任意。"
    }
  }
}
