{
  "id": "baseline-1",
  "experiment": "harness-intro",
  "condition": "baseline",
  "createdAt": "2026-09-10T04:47:31.110Z",
  "prompt": "experiments/harness-intro/prompt.md",
  "source": {
    "files": [
      "App.tsx",
      "deck.css",
      "index.css",
      "main.tsx",
      "runtime/Deck.tsx",
      "runtime/Fragment.tsx",
      "runtime/Slide.tsx",
      "runtime/canvas.ts",
      "runtime/context.ts",
      "runtime/hash.ts",
      "runtime/index.ts",
      "runtime/runtime.css"
    ]
  }
}
